[
  {
    "id": "capacity-peak-change",
    "topicId": "capacity-estimation",
    "level": "beginner",
    "kind": "prediction",
    "prompt": "You double only the peak factor. Which baseline outputs should double?",
    "options": [
      {
        "id": "a",
        "label": "Peak RPS, peak response bandwidth, and mean peak concurrency"
      },
      {
        "id": "b",
        "label": "Daily requests and retained storage"
      },
      {
        "id": "c",
        "label": "Write percentage and replication factor"
      }
    ],
    "correctOptionId": "a",
    "explanation": "Those three results use peak RPS directly. Daily volume and retained data do not use the peak factor in this model.",
    "followUp": "Try a 10× peak factor in the calculator and compare the calculation trail."
  },
  {
    "id": "capacity-average-rps",
    "topicId": "capacity-estimation",
    "level": "beginner",
    "kind": "calculation",
    "prompt": "Ten million requests arrive across a day. What is the average request rate?",
    "options": [
      {
        "id": "a",
        "label": "About 11.57 requests/s"
      },
      {
        "id": "b",
        "label": "About 115.74 requests/s"
      },
      {
        "id": "c",
        "label": "About 1,157.41 requests/s"
      }
    ],
    "correctOptionId": "b",
    "explanation": "Divide 10,000,000 by 86,400 seconds. The result is approximately 115.74 requests per second.",
    "followUp": "Explain why this average alone is unsafe as a peak capacity target."
  },
  {
    "id": "capacity-burst-interview",
    "topicId": "capacity-estimation",
    "level": "intermediate",
    "kind": "design-decision",
    "prompt": "Mean peak concurrency is 116, but 500 requests arrive at once. Why does 116 not prove the service can absorb the burst?",
    "rubric": [
      "Distinguishes a long-run average from an instantaneous burst.",
      "Mentions workers, queues, service-time variation, or dependency limits.",
      "Proposes a bounded load test or request-flow experiment with explicit success criteria."
    ],
    "modelAnswer": "The 116 figure is peak rate multiplied by mean latency, so it describes mean work in flight under a stable workload. A burst of 500 can exceed available workers, queue capacity, connections, or a dependency limit before that average says anything useful. I would model the burst and then load test the chosen design, checking rejection rate and latency percentiles.",
    "sourceIds": ["little-law", "google-sre-load-balancing"]
  },
  {
    "id": "capacity-read-share-storage",
    "topicId": "capacity-estimation",
    "level": "beginner",
    "kind": "prediction",
    "prompt": "Keep the Interview baseline except increase reads from 90% to 99%. What happens to retained copies and peak response bandwidth?",
    "options": [
      {
        "id": "a",
        "label": "Copies fall to 109.5 GB; bandwidth stays about 9.26 Mb/s."
      },
      {
        "id": "b",
        "label": "Both storage and bandwidth fall tenfold."
      },
      {
        "id": "c",
        "label": "Copies stay at 1,095 GB because daily requests stay fixed."
      }
    ],
    "correctOptionId": "a",
    "explanation": "Ten million requests/day × 1% writes = 100,000 new records/day. With 1 kB/record, 365 days, and three copies: 100,000 × 1 × 365 × 3 ÷ 1,000,000 = 109.5 GB. Peak request rate and the separate 2 kB response assumption did not change, so bandwidth stays about 9.26 Mb/s.",
    "followUp": "Run the baseline, change only Read share to 99, and explain the one-new-record-per-write assumption."
  },
  {
    "id": "capacity-headroom-range",
    "topicId": "capacity-estimation",
    "level": "intermediate",
    "kind": "design-decision",
    "prompt": "The baseline shows a 752.3 req/s target peak and a High traffic scenario of 694.4 req/s. Why is High smaller than the target, and what would you test?",
    "rubric": [
      "Distinguishes peak rate before headroom from the planning target.",
      "Explains 578.70 × 1.20 versus 578.70 × 1.30; scenarios are not confidence intervals.",
      "Plans a whole-path test with workload shape, latency/rejection objectives, and revised assumptions."
    ],
    "modelAnswer": "The target includes 30% headroom on the 578.70 req/s peak. High uses a separate 20% traffic increase before headroom, while response size and latency stay fixed. They answer different questions; High is not an upper capacity guarantee. I would test the target workload and plausible bursts on the whole request path, observe rejection and latency percentiles, and revise peak shape, payload, and latency assumptions.",
    "sourceIds": ["aws-performance-efficiency"]
  }
]
